{
    "$schema_version": "3.1",
    "schema_type": "Session-Packet",
    "session_metadata": {
        "session_id": "SESS-2026-03-09-001",
        "project_id": "PROJ-ORCH-V3",
        "timestamp": "2026-03-09T03:00:00Z"
    },
    "session_frame": {
        "current_objective": "Initial repo audit",
        "progress_status": "in-progress",
        "active_context": [
            "/00_Project-Core",
            "/docs"
        ],
        "working_notes": [
            "Analyzed schema fragmentation",
            "Identified missing state folders"
        ]
    },
    "artifacts_produced": [
        "/docs/REPO-MAP.md"
    ]
}